DAQING (XINGSHUGANG),SAERTU-PUTAOHUA-GAOTAIZI (XINGNAN),1P ,CHINA,ASIA-PACIFIC,SONGLIAO,46.3209,124.8999,OIL,2005.0,SECONDARY RECOVERY,DECLINE,873.00,10.0,68774.0,ONSHORE,-492.13,120.0,1610.0,AQUIFER DRIVE,113:INVERSION ANTICLINE,2723.1,2230.97,4.0,1056.43,CRETACEOUS,23:LACUSTRINE,LABYRINTH,SHALELATERAL FACIES CHANGE/LATERAL SHALE-OUT/SEALING FAULT,600.0,,12.8,SANDSTONE,FINE-GRAINED SAND,ARKOSE,,PRIMARY INTERGRANULAR,25.6,,34.2,6.74,21.5,4.2,213.0,,1.12,1027.0,8218.0,35.0,1899.0,12.6,54.1,,CONTINUOUS WATER INJECTION,CHEMICAL,DRILLING/STIMULATION/WATER INJECTION OPTIMIZATION/ARTIFICIAL LIFT/OTHER RESERVOIR MANAGEMENT,INFILL WELL,ACIDIZATION/HYDRAULIC FRACTURING (SINGLE STAGE),WATER INJECTION ON A ZONAL BASIS/MODIFICATION IN INJECTION PATTERN,ROD PUMP/ESP/PCP,,ADDITIONAL PERFORATION/PROFILE MODIFICATION/STEP-OUT DEVELOPMENT DRILLING/WATER PLUGGING/WAX REMOVAL,3116.5
DELHI,HOLT-BRYANT,1P ,UNITED STATES OF AMERICA,NORTH AMERICA,GULF OF MEXICO NORTHERN ONSHORE,32.449,-91.464,OIL,2013.0,SECONDARY RECOVERY,SECONDARY REJUVENATING,,0.0,,ONSHORE,-90.0,135.0,1547.0,AQUIFER DRIVE,2211:REGIONAL SUBCROP,3013.0,2923.0,4.0,,CRETACEOUS,24:COASTAL,JIGSAW-PUZZLE, LATERAL FACIES CHANGE,,,6.1,SANDSTONE,FINE-GRAINED SAND,QUARTZ ARENITE,,PRIMARY INTERGRANULAR,32.3,1400.0,42.0,,0.0,0.0,455.0,,1.25,1515.0,84146.0,30.0,321.0,40.0,69.0,,CONTINUOUS WATER INJECTION/CO2 IMMISCIBLE INJECTION,,ARTIFICIAL LIFT/OTHER RESERVOIR MANAGEMENT,,,,ROD PUMP/GAS LIFT,,FLOWING RATE CONTROL/RE-COMPLETION,3400.0
DELHI,MAY-LIBBY,1P ,UNITED STATES OF AMERICA,NORTH AMERICA,GULF OF MEXICO NORTHERN ONSHORE,32.449,-91.464,OIL,1959.0,SECONDARY RECOVERY,MATURE,28.00,40.0,2005.0,ONSHORE,-90.0,135.0,1556.0,GAS DRIVE,221:SUB-UNCONFORMITY TRUNCATION,3250.0,3160.0,3.0,,CRETACEOUS,21:FLUVIAL,,,,,1.34,SANDSTONE,MEDIUM-GRAINED SAND,QUARTZ ARENITE,,,32.2,1069.0,40.0,3.0,0.0,0.0,462.0,,1.22,,,30.0,8.35,32.0,47.03,,,THERMAL,STIMULATION/WATER INJECTION OPTIMIZATION/ARTIFICIAL LIFT/OTHER RESERVOIR MANAGEMENT,,ACIDIZATION,MODIFICATION IN INJECTION PATTERN,ROD PUMP/GAS LIFT,,ACID WASH/CORROSION INHIBITOR TREATMENT/RE-COMPLETION/SCALE REMOVAL/SHUT-IN WELL REOPEN,3400.0
DELTA SOUTH,G2 SAND (AGBADA),1P ,NIGERIA,AFRICA,NIGER DELTA,5.6139,5.1018,OIL,1978.0,SECONDARY RECOVERY,DECLINE,17.00,0.0,24700.0,OFFSHORE,13.0,225.0,3936.0,GAS DRIVE,1181:ROLLOVER ANTICLINE,7985.0,7998.0,7.0,1552.0,NEOGENE,24:COASTAL,TANK LIKE,BLOCK-BOUNDING FAULTNONE,,,,SANDSTONE,,QUARTZ ARENITE,,PRIMARY INTERGRANULAR,28.0,2000.0,39.0,0.25,0.0,0.0,1077.0,,1.64,3770.0,17051.0,14.0,,29.0,38.0,,CONTINUOUS WATER INJECTION,,ARTIFICIAL LIFT/OTHER RESERVOIR MANAGEMENT,,,,GAS LIFT,,HIGH GOR WELL SHUT-IN/H2S CONTROL,
DELTA SOUTH,G3 SAND (AGBADA),1P ,NIGERIA,AFRICA,NIGER DELTA,5.6139,5.1018,OIL,1978.0,SECONDARY RECOVERY,DECLINE,14.00,0.0,37400.0,OFFSHORE,13.0,225.0,3829.0,GAS DRIVE,1181:ROLLOVER ANTICLINE,8215.0,8228.0,7.0,837.0,NEOGENE,24:COASTAL,TANK LIKE,BLOCK-BOUNDING FAULTNONE,,,,SANDSTONE,,QUARTZ ARENITE,,PRIMARY INTERGRANULAR,26.5,2000.0,39.0,0.25,0.0,0.0,1030.0,,1.63,3690.0,17051.0,13.0,378.0,47.0,47.0,,CONTINUOUS WATER INJECTION,,ARTIFICIAL LIFT/OTHER RESERVOIR MANAGEMENT,,,,GAS LIFT,,HIGH GOR WELL SHUT-IN/H2S CONTROL,
DIANA,A-50 SAND (OIL RIM),1P ,UNITED STATES OF AMERICA,NORTH AMERICA,GULF OF MEXICO NORTHERN OFFSHORE,27.0352,-94.8754,OIL,2007.0,PRIMARY RECOVERY,DECLINE,6.00,300.0,13978.0,OFFSHORE,4650.0,98.0,6204.0,AQUIFER DRIVE,2232:ONLAP ONTO STRUCTURAL FLANK UNCONFORMITY,4800.0,9450.0,8.0,,NEOGENE,25:DEEP MARINE,JIGSAW-PUZZLE,SHALELATERAL FACIES CHANGE,75.0,0.6,4.27,SANDSTONE,FINE-GRAINED SAND,,,PRIMARY INTERGRANULAR,31.0,1079.0,35.0,5.23,0.0,0.0,485.0,,1.25,,,17.0,35.3,,36.5,,,,DRILLING/SAND CONTROL/OTHER RESERVOIR MANAGEMENT,HORIZONTAL WELL,,,,GRAVEL PACK,COILED TUBING TREATMENT/RE-COMPLETION/WATER PLUGGING,10350.0
DJEITUN,RED SERIES,1P ,TURKMENISTAN,FORMER SOVIET UNION,CASPIAN SOUTH,39.47,53.15,OIL,2009.0,DEVELOPING,DEVELOPING,50.00,0.0,42808.0,OFFSHORE,36.0,138.0,4974.0,AQUIFER DRIVE,1111:THRUST ANTICLINE,7510.0,7546.0,30.0,,NEOGENE,23:LACUSTRINE,LAYER-CAKE,BLOCK-BOUNDING FAULT/SHALENONE,10500.0,0.28,,SANDSTONE,FINE-GRAINED SAND,FELDSPATHIC LITHARENITE,,PRIMARY INTERGRANULAR,17.0,22.0,39.5,0.5,9.0,0.5,,30.0,,,20000.0,40.0,292.0,,33.0,,,,DRILLING/OTHER RESERVOIR MANAGEMENT,INFILL WELL,,,,,WAX REMOVAL,8600.0
DOLIN,WYHODA-BYSTRYCIA-MANIAVA-MENILITE,1P ,UKRAINE,FORMER SOVIET UNION,CARPATHIAN,49.0185,23.8943,OIL,1993.0,SECONDARY RECOVERY,DECLINE,289.00,18.0,38000.0,ONSHORE,-1230.0,167.0,4627.0,AQUIFER DRIVE,1111:THRUST ANTICLINE,5170.0,3940.0,16.0,4265.0,PALEOGENE,25:DEEP MARINE,JIGSAW-PUZZLE,BLOCK-BOUNDING FAULT/SHALENONE,870.0,0.65,88.09,SANDSTONE,FINE-GRAINED SAND,QUARTZ ARENITE,TYPE II,PRIMARY INTERGRANULAR,12.0,13.0,36.0,1.0,6.5,0.0,1060.0,,,3640.0,157000.0,26.0,823.0,,34.0,,CONTINUOUS WATER INJECTION,,DRILLING/STIMULATION,HORIZONTAL WELL/MULTI-LATERAL WELL,HYDRAULIC FRACTURING (SINGLE STAGE),,,,,7940.0
DOLLARHIDE,THIRTYONE (MAIN DOLLARHIDE UNIT),1P ,UNITED STATES OF AMERICA,NORTH AMERICA,PERMIAN,32.1701,-103.081,OIL,2011.0,ENHANCED OIL RECOVERY,SECONDARY MATURE,101.00,30.0,8721.0,ONSHORE,-3300.0,120.0,3300.0,GAS DRIVE,2212:PALEOSTRUCTURAL SUBCROP,7600.0,4300.0,7.0,1000.0,DEVONIAN,25:DEEP MARINE,LAYER-CAKE,BLOCK-BOUNDING FAULT/TIGHT CLASTICS/TIGHT CARBONATELATERAL FACIES CHANGE/SEALING FAULT,210.0,0.4,27.43,SANDSTONE,GRAINSTONE,SPONGE,TYPE IV,MOLDIC,14.0,20.0,40.0,0.4,0.0,0.0,1270.0,,1.66,2830.0,75000.0,27.6,146.0,13.4,58.2,,CONTINUOUS WATER INJECTION,MISCIBLE,DRILLING/ARTIFICIAL LIFT/OTHER RESERVOIR MANAGEMENT,INFILL WELL,,,ROD PUMP,,GAS INJECTION OPTIMIZATION/PROFILE MODIFICATION/RE-COMPLETION,4600.0
DONGXIN,SHAHEJIE,1P ,CHINA,ASIA-PACIFIC,BOHAI,37.4833,118.5499,OIL,2002.0,SECONDARY RECOVERY,DECLINE,1277.00,17.0,62500.0,ONSHORE,-16.0,173.02580862074188,3115.0,GAS DRIVE,113:INVERSION ANTICLINE,5590.0,5580.0,5.0,,PALEOGENE,21:FLUVIAL,LAYER-CAKE,BLOCK-BOUNDING FAULT/SHALELATERAL SHALE-OUT,,0.2,37.8,SANDSTONE,FINE-GRAINED SAND,ARKOSE,,PRIMARY INTERGRANULAR,27.0,1200.0,25.0,8.0,10.0,0.92,220.0,,,1600.0,35000.0,20.0,1754.0,,35.0,,CONTINUOUS WATER INJECTION,CHEMICAL,DRILLING/ARTIFICIAL LIFT/SAND CONTROL/OTHER RESERVOIR MANAGEMENT,INFILL WELL/HORIZONTAL WELL,,,ESP,SAND SCREEN,RE-PERFORATION/WATER PLUGGING,
DOUGLAS,ORMSKIRK SANDSTONE,1P ,UNITED KINGDOM,EUROPE,IRISH SEA EAST,53.5291,-3.5651,OIL,2006.0,SECONDARY RECOVERY,DECLINE,11.00,0.0,34559.0,OFFSHORE,110.0,86.0,1125.0,AQUIFER DRIVE,1211:TILTED FAULT-BLOCK,2030.0,2140.0,13.0,370.0,TRIASSIC,22:DESERT,LAYER-CAKE,BLOCK-BOUNDING FAULT/SHALE/TAR MATNONE,650.0,0.9,,SANDSTONE,FINE-GRAINED SAND/MEDIUM-GRAINED SAND,SUBLITHARENITE,,PRIMARY INTERGRANULAR,16.0,400.0,44.0,,0.0,0.5,170.0,,1.08,,270000.0,,202.0,,50.0,,CONTINUOUS WATER INJECTION/GAS RECYCLING,,DRILLING/ARTIFICIAL LIFT/OTHER RESERVOIR MANAGEMENT,HORIZONTAL WELL,,,ESP,,STEP-OUT DEVELOPMENT DRILLING,2240.0
DRAUGEN,ROGN,1P ,NORWAY,EUROPE,MID-NORWAY SHELF,64.3655,7.7891,OIL,2012.0,SECONDARY RECOVERY,DECLINE,14.00,1111.97,,OFFSHORE,820.21,154.4,2392.98,AQUIFER DRIVE,1212:HORST BLOCK,4416.01,5236.22,0.5,137.8,JURASSIC,24:COASTAL,TANK LIKE, SEALING FAULT,,,,SANDSTONE,FINE-GRAINED SAND,QUARTZ ARENITE,,PRIMARY INTERGRANULAR,30.0,3546.37,40.0,0.74,0.0,0.0,331.26,,,717.94,37500.0,,,,54.4,,CONTINUOUS WATER INJECTION,,DRILLING/WATER INJECTION OPTIMIZATION/ARTIFICIAL LIFT/SAND CONTROL/OTHER RESERVOIR MANAGEMENT,INFILL WELL/HORIZONTAL WELL,SCALE INHIBITOR TREATMENT,,GAS LIFT,GRAVEL PACK,PUMP SIZE OPTIMIZATION/SIDETRACKING/STEP-OUT DEVELOPMENT DRILLING,5374.02
DULANG,BEKOK (GROUP D-F),1P ,MALAYSIA,ASIA-PACIFIC,MALAY,5.8283,104.1961,OIL,2004.0,ENHANCED OIL RECOVERY,PEAK OR PLATEAU,118.00,120.0,76800.0,OFFSHORE,250.0,205.0,1665.0,GAS DRIVE,113:INVERSION ANTICLINE,3360.0,3610.0,5.0,330.0,NEOGENE,24:COASTAL,JIGSAW-PUZZLE,BLOCK-BOUNDING FAULT/SHALELATERAL FACIES CHANGE/LATERAL SHALE-OUT,1800.0,,,SANDSTONE,VERY FINE-GRAINED SAND/FINE-GRAINED SAND,ARKOSE,,PRIMARY INTERGRANULAR,30.0,200.0,39.0,0.85,20.0,0.0,400.0,,1.28,1550.0,,34.0,1083.0,,38.0,,CONTINUOUS WATER INJECTION/GAS RECYCLING,MISCIBLE,DRILLING/SAND CONTROL,INFILL WELL/HORIZONTAL WELL,,,,GRAVEL PACK,,4174.5
DUNBAR,BRENT,1P ,UNITED KINGDOM,EUROPE,NORTH SEA NORTHERN,60.6,1.65,OIL,2006.0,SECONDARY RECOVERY,DECLINE,26.00,400.0,53933.0,OFFSHORE,475.72,266.0,8267.0,AQUIFER DRIVE,2212:PALEOSTRUCTURAL SUBCROP,10351.05,10826.77,8.0,1214.0,JURASSIC,24:COASTAL,LAYER-CAKE,BLOCK-BOUNDING FAULT/SHALE/COALLATERAL SHALE-OUT/SEALING FAULT,500.0,0.75,,SANDSTONE,MEDIUM-GRAINED SAND,QUARTZ ARENITE,,PRIMARY INTERGRANULAR,15.0,43.0,43.0,0.12,0.0,0.0,2800.0,,,5439.0,21000.0,17.0,846.0,,29.0,49.0,CONTINUOUS WATER INJECTION,,DRILLING/STIMULATION/WATER INJECTION OPTIMIZATION/OTHER RESERVOIR MANAGEMENT,HORIZONTAL WELL/MULTI-LATERAL WELL,ACIDIZATION/HYDRAULIC FRACTURING (SINGLE STAGE)/SCALE INHIBITOR TREATMENT,SELECTIVE INJECTION,,,SIDETRACKING,11975.0
DUNLIN,BRENT,1P ,UNITED KINGDOM,EUROPE,NORTH SEA NORTHERN,61.2667,1.6,OIL,2006.0,SECONDARY RECOVERY,MATURE,41.00,80.0,115384.0,OFFSHORE,495.0,210.0,6020.0,AQUIFER DRIVE,2212:PALEOSTRUCTURAL SUBCROP,8005.0,8500.0,2.5,705.0,JURASSIC,24:COASTAL,LAYER-CAKE,BLOCK-BOUNDING FAULT/SHALELATERAL FACIES CHANGE/SEALING FAULT,450.0,,,SANDSTONE,MEDIUM-GRAINED SAND,SUBARKOSE,,PRIMARY INTERGRANULAR,23.0,100.0,35.0,1.73,0.0,0.0,220.0,,1.13,960.0,24000.0,40.0,827.0,,47.0,,CONTINUOUS WATER INJECTION,,DRILLING/OTHER RESERVOIR MANAGEMENT,INFILL WELL,,,,,ADDITIONAL PERFORATION/SELECTIVE PERFORATION,9000.0
DURI,SIHAPAS,1P ,INDONESIA,ASIA-PACIFIC,SUMATRA CENTRAL,1.2956,101.2304,OIL,2011.0,ENHANCED OIL RECOVERY,SECONDARY DECLINE,,11.63,300000.0,ONSHORE,-120.0,100.94,267.0,AQUIFER DRIVE,112:TRANSPRESSIONAL ANTICLINE,400.0,280.0,,370.0,NEOGENE,24:COASTAL,LAYER-CAKE,SHALESEALING FAULT,500.0,,76.2,SANDSTONE,FINE-GRAINED SAND/MEDIUM-GRAINED SAND/COARSE-GRAINED SAND,SUBARKOSE/SUBLITHARENITE,,PRIMARY INTERGRANULAR,34.0,1500.0,20.0,150.0,12.0,0.0,15.0,,1.02,175.0,,45.0,,9.0,60.0,,CONTINUOUS WATER INJECTION,,DRILLING/STIMULATION/WATER INJECTION OPTIMIZATION/ARTIFICIAL LIFT/SAND CONTROL/OTHER RESERVOIR MANAGEMENT,INFILL WELL/HORIZONTAL WELL,ACIDIZATION,MODIFICATION IN INJECTION PATTERN,ROD PUMP,GRAVEL PACK/SLOTTED LINER/PRE-PACKED SAND SCREEN/FRAC PACK,COILED TUBING TREATMENT/PUMP SIZE OPTIMIZATION/RE-PERFORATION/SAND CLEANING/SCALE REMOVAL/STEAM INJECTION OPTIMIZATION,640.09
DZHIGALYBEG,RED SERIES,1P ,TURKMENISTAN,FORMER SOVIET UNION,CASPIAN SOUTH,39.52,53.2,OIL,2006.0,DEVELOPING,DEVELOPING,,0.0,,OFFSHORE,69.0,145.0,6815.0,AQUIFER DRIVE,1111:THRUST ANTICLINE,10101.0,10170.0,26.0,,NEOGENE,23:LACUSTRINE,LAYER-CAKE,BLOCK-BOUNDING FAULT/SHALENONE,8200.0,0.25,,SANDSTONE,FINE-GRAINED SAND,FELDSPATHIC LITHARENITE,,PRIMARY INTERGRANULAR,18.0,100.0,33.0,0.7,26.0,0.55,,24.0,,,,35.0,385.0,,36.4,43.4,,,OTHER RESERVOIR MANAGEMENT,,,,,,WAX REMOVAL,10700.0
EAST BREAKS 160,TA SAND,1P ,UNITED STATES OF AMERICA,NORTH AMERICA,GULF OF MEXICO NORTHERN OFFSHORE,27.8329,-94.5008,OIL,2010.0,PRIMARY RECOVERY,SECONDARY DECLINE,,40.0,1245.0,OFFSHORE,935.0,108.0,2465.0,AQUIFER DRIVE,1181:ROLLOVER ANTICLINE,2865.0,3800.0,6.0,,NEOGENE,25:DEEP MARINE,LAYER-CAKE,BLOCK-BOUNDING FAULT/SHALELATERAL SHALE-OUT,400.0,0.85,30.18,SANDSTONE,FINE-GRAINED SAND/MEDIUM-GRAINED SAND,,,PRIMARY INTERGRANULAR,28.0,,32.0,,0.0,0.0,2078.0,123.0,,,,35.0,16.6,34.0,34.0,37.0,,,DRILLING/STIMULATION/ARTIFICIAL LIFT/SAND CONTROL/OTHER RESERVOIR MANAGEMENT,,ACIDIZATION,,GAS LIFT,GRAVEL PACK,COILED TUBING TREATMENT/HIGH GOR WELL SHUT-IN/RE-COMPLETION/SELECTIVE PERFORATION/SIDETRACKING,4321.0
EAST PAINTER RESERVOIR,NUGGET,1P ,UNITED STATES OF AMERICA,NORTH AMERICA,FOSSIL,41.4039,-110.831,OIL,2009.0,SECONDARY RECOVERY,DECLINE,30.00,80.0,10319.0,ONSHORE,-7175.0,233.450947798426,460.0,GAS DRIVE,1111:THRUST ANTICLINE,10500.0,3325.0,65.0,1375.0,JURASSIC/TRIASSIC,22:DESERT,LAYER-CAKE,TIGHT CLASTICSLATERAL FACIES CHANGE,900.0,,,SANDSTONE,FINE-GRAINED SAND/MEDIUM-GRAINED SAND,QUARTZ ARENITE,TYPE II,PRIMARY INTERGRANULAR,14.1,22.8,105.0,0.18,0.0,1.8,2960.0,,2.63,4585.0,25000.0,,299.0,,49.0,,CONTINUOUS WATER INJECTION/GAS RECYCLING,MISCIBLE,DRILLING/STIMULATION/OTHER RESERVOIR MANAGEMENT,HORIZONTAL WELL/SLIM-HOLE WELL,ACIDIZATION,,,,COILED TUBING TREATMENT/SIDETRACKING,
EAST TEXAS,WOODBINE,1P ,UNITED STATES OF AMERICA,NORTH AMERICA,GULF OF MEXICO NORTHERN ONSHORE,32.1853,-94.9257,OIL,2008.0,SECONDARY RECOVERY,MATURE,31000.00,4.2,592580.0,ONSHORE,-360.0,146.0,1635.0,AQUIFER DRIVE,2211:REGIONAL SUBCROP,3460.0,3100.0,0.5,224.5,CRETACEOUS,24:COASTAL,TANK LIKE, NONE,51.0,0.73,11.28,SANDSTONE,COARSE-GRAINED SAND,QUARTZ ARENITE,,PRIMARY INTERGRANULAR,25.2,2098.0,39.0,0.98,0.0,0.63,357.0,,1.26,755.0,64725.0,14.1,7000.0,,78.4,,CONTINUOUS WATER INJECTION,,WATER INJECTION OPTIMIZATION/ARTIFICIAL LIFT/OTHER RESERVOIR MANAGEMENT,INFILL WELL,,MODIFICATION IN INJECTION PATTERN/SELECTIVE INJECTION,ROD PUMP,,ADDITIONAL PERFORATION/PROFILE MODIFICATION/RE-COMPLETION/RE-PERFORATION/WATER CONING CONTROL,3240.0
EK-BALAM,EK BALAM,1P ,MEXICO,LATIN AMERICA,CAMPECHE,19.5069,-91.92,OIL,1999.0,SECONDARY RECOVERY,DECLINE,,160.0,71000.0,OFFSHORE,130.0,240.0,8050.0,GAS DRIVE,1153:DIAPIRIC PIERCEMENT ANTICLINE,12660.0,12790.0,22.0,2530.0,JURASSIC,22:DESERT,JIGSAW-PUZZLE,BLOCK-BOUNDING FAULTLATERAL FACIES CHANGE,,,,SANDSTONE,FINE-GRAINED SAND/MEDIUM-GRAINED SAND,QUARTZ ARENITE,,PRIMARY INTERGRANULAR,21.0,400.0,27.0,,0.0,0.0,169.0,,,,280000.0,21.0,1240.0,,15.0,,CONTINUOUS WATER INJECTION/GAS INJECTION,,ARTIFICIAL LIFT,,,,ESP,,,14600.0
EL BORMA,KIRCHAOU,1P ,ALGERIA-TUNISIA,AFRICA,GHADAMES,31.65,9.18,OIL,2002.0,SECONDARY RECOVERY,DECLINE,148.00,110.0,87000.0,ONSHORE,-980.0,180.0,3770.0,GAS DRIVE,1142:BASEMENT-DRAPE ANTICLINE,7870.0,6890.0,0.5,330.0,TRIASSIC,21:FLUVIAL,JIGSAW-PUZZLE,SHALELATERAL FACIES CHANGE/SEALING FAULT,353.0,0.5,30.48,SANDSTONE,FINE-GRAINED SAND/MEDIUM-GRAINED SAND,SUBARKOSE,,PRIMARY INTERGRANULAR,17.0,500.0,42.0,0.29,0.0,0.0,1400.0,,1.7,2845.0,250000.0,,1425.0,,59.0,,CONTINUOUS WATER INJECTION/WAG IMMISCIBLE INJECTION,,DRILLING/WATER INJECTION OPTIMIZATION/ARTIFICIAL LIFT,INFILL WELL,,MODIFICATION IN INJECTION PATTERN,ROD PUMP/ESP/PCP,,,6890.0
EL CARITO,NARICUAL-SAN JUAN,1P ,VENEZUELA,LATIN AMERICA,EASTERN VENEZUELA,9.6548,-63.5544,OIL,2002.0,SECONDARY RECOVERY,PEAK OR PLATEAU,77.00,200.0,295000.0,ONSHORE,-570.0,287.0,11500.0,GAS DRIVE,1111:THRUST ANTICLINE,12170.0,11600.0,12.0,4985.0,PALEOGENE/CRETACEOUS,24:COASTAL,JIGSAW-PUZZLE,BLOCK-BOUNDING FAULT/SHALELATERAL FACIES CHANGE,2400.0,0.75,548.65,SANDSTONE,FINE-GRAINED SAND/MEDIUM-GRAINED SAND,QUARTZ ARENITE,,SECONDARY INTERGRANULAR,13.0,100.0,30.0,0.4,0.0,0.0,2900.0,242.0,,5500.0,,13.0,8097.0,17.0,49.0,,CONTINUOUS WATER INJECTION/GAS INJECTION,,STIMULATION,,HYDRAULIC FRACTURING (SINGLE STAGE),,,,,14000.0
EL DORADO,ADMIRE 650 SAND,1P ,UNITED STATES OF AMERICA,NORTH AMERICA,CHEROKEE,37.8526,-97.8984,OIL,1998.0,ABANDONED,MATURE,375.00,6.4,116000.0,ONSHORE,-1200.0,70.0,200.0,GAS DRIVE,1142:BASEMENT-DRAPE ANTICLINE,625.0,-575.0,1.0,,PERMIAN,24:COASTAL,JIGSAW-PUZZLE, LATERAL FACIES CHANGE,40.0,0.37,,SANDSTONE,FINE-GRAINED SAND,SUBLITHARENITE,,PRIMARY INTERGRANULAR,28.0,240.0,37.0,4.0,0.0,0.0,,,1.0,,82600.0,55.0,108.0,21.0,34.0,,CONTINUOUS WATER INJECTION/GAS INJECTION,THERMAL/CHEMICAL,STIMULATION,,HYDRAULIC FRACTURING (SINGLE STAGE),,,,,
EL FURRIAL,MERECURE-CARATAS-VIDONO,1P ,VENEZUELA,LATIN AMERICA,EASTERN VENEZUELA,9.6835,-63.4529,OIL,2006.0,ENHANCED OIL RECOVERY,DECLINE,163.00,350.0,453682.0,ONSHORE,-150.0,290.0,11258.0,GAS DRIVE,1111:THRUST ANTICLINE,12550.0,12400.0,15.0,2850.0,NEOGENE/PALEOGENE,24:COASTAL,JIGSAW-PUZZLE,SHALE/TAR MATLATERAL FACIES CHANGE/SEALING FAULT,1600.0,0.55,259.08,SANDSTONE,FINE-GRAINED SAND/MEDIUM-GRAINED SAND,QUARTZ ARENITE,,SECONDARY INTERGRANULAR,15.0,480.0,26.0,0.5,0.0,0.2,950.0,,1.6,4643.0,,24.0,8600.0,11.6,48.0,,CONTINUOUS WATER INJECTION/GAS INJECTION,MISCIBLE,DRILLING/STIMULATION,INFILL WELL,HYDRAULIC FRACTURING (SINGLE STAGE),,,,COILED TUBING TREATMENT/PROFILE MODIFICATION/RE-COMPLETION/RE-PERFORATION,13800.0
EL FURRIAL,SAN JUAN,1P ,VENEZUELA,LATIN AMERICA,EASTERN VENEZUELA,9.6835,-63.4529,OIL,2006.0,ENHANCED OIL RECOVERY,DECLINE,,0.0,,ONSHORE,-150.0,295.0,10450.0,GAS DRIVE,1111:THRUST ANTICLINE,12550.0,12400.0,15.0,2850.0,CRETACEOUS,24:COASTAL,JIGSAW-PUZZLE,SHALE/TAR MATLATERAL FACIES CHANGE/SEALING FAULT,1000.0,0.6,182.88,SANDSTONE,FINE-GRAINED SAND/MEDIUM-GRAINED SAND,SUBARKOSE,,SECONDARY INTERGRANULAR,12.0,75.0,26.0,0.5,0.0,0.2,950.0,,1.6,4643.0,,24.0,617.0,14.0,64.0,,CONTINUOUS WATER INJECTION,MISCIBLE,DRILLING/STIMULATION,INFILL WELL,HYDRAULIC FRACTURING (SINGLE STAGE),,,,COILED TUBING TREATMENT/PROFILE MODIFICATION/RE-COMPLETION/RE-PERFORATION,14850.0
EL MORGAN,KAREEM,1P ,EGYPT,AFRICA,GULF OF SUEZ,28.2277,33.4349,OIL,2000.0,SECONDARY RECOVERY,MATURE,,30.0,260000.0,OFFSHORE,125.0,174.0,2990.0,GAS DRIVE,1212:HORST BLOCK,5345.0,5470.0,8.0,950.0,NEOGENE,24:COASTAL,LAYER-CAKE,BLOCK-BOUNDING FAULT/SHALELATERAL SHALE-OUT/SEALING FAULT,,,182.88,SANDSTONE,MEDIUM-GRAINED SAND/COARSE-GRAINED SAND,ARKOSE,,PRIMARY INTERGRANULAR,23.0,420.0,33.0,,0.0,0.0,600.0,,1.34,2260.0,110000.0,30.0,2700.0,20.0,56.0,,CONTINUOUS WATER INJECTION,,DRILLING/STIMULATION/WATER INJECTION OPTIMIZATION/ARTIFICIAL LIFT/OTHER RESERVOIR MANAGEMENT,INFILL WELL,SCALE INHIBITOR TREATMENT,WATER INJECTION ON A ZONAL BASIS/MODIFICATION IN INJECTION PATTERN,GAS LIFT,,RE-COMPLETION,6100.0
EL PORVENIR FIELD COMPLEX,TORDILLO-CHALLACO (CHALLACO FIELD),1P ,ARGENTINA,LATIN AMERICA,NEUQUEN,-39.0379,-68.7904,OIL,2012.0,SECONDARY RECOVERY,SECONDARY DECLINE,,15.57,5860.85,ONSHORE,-1394.36,140.77232150008166,1493.45,AQUIFER DRIVE,122:REVERSE FAULT,2969.16,1574.8,1.5,393.7,JURASSIC,21:FLUVIAL,JIGSAW-PUZZLE,BLOCK-BOUNDING FAULT/SHALELATERAL FACIES CHANGE,433.07,0.35,,SANDSTONE,COARSE-GRAINED SAND,LITHARENITE,,PRIMARY INTERGRANULAR,17.0,15.0,25.72,19.0,0.0,0.0,134.75,,1.08,,30000.0,35.0,,,41.0,,CONTINUOUS WATER INJECTION,,DRILLING/STIMULATION/ARTIFICIAL LIFT/OTHER RESERVOIR MANAGEMENT,INFILL WELL,HYDRAULIC FRACTURING (SINGLE STAGE),,ROD PUMP/ESP/PCP,,HIGH WATER-CUT WELL SHUT-IN/PUMP SIZE OPTIMIZATION/RE-COMPLETION/SHUT-IN WELL REOPEN/STEP-OUT DEVELOPMENT DRILLING/WATER PLUGGING,
EL TORDILLO,COMODORO RIVADAVIA,1P ,ARGENTINA,LATIN AMERICA,GOLFO SAN JORGE,-45.8708,-67.8612,OIL,2012.0,SECONDARY RECOVERY,,,15.0,,ONSHORE,-1610.0,214.0,2717.0,GAS DRIVE,1181:ROLLOVER ANTICLINE,5154.2,3543.31,,,CRETACEOUS,21:FLUVIAL,JIGSAW-PUZZLE,BLOCK-BOUNDING FAULTLATERAL SHALE-OUT/SEALING FAULT,2900.26,0.5,,SANDSTONE,MEDIUM-GRAINED SAND,FELDSPATHIC LITHARENITE,,PRIMARY INTERGRANULAR,15.0,45.0,21.0,18.0,0.0,0.0,,,1.2,2350.0,,48.0,,,,,CONTINUOUS WATER INJECTION,CHEMICAL,DRILLING/STIMULATION/WATER INJECTION OPTIMIZATION/ARTIFICIAL LIFT/OTHER RESERVOIR MANAGEMENT,INFILL WELL,HYDRAULIC FRACTURING (SINGLE STAGE),MODIFICATION IN INJECTION PATTERN,,,PROFILE MODIFICATION/RE-COMPLETION,6162.0
EL TRAPIAL,AVILE (AGRIO),1P ,ARGENTINA,LATIN AMERICA,NEUQUEN,-37.3955,-69.3817,OIL,2006.0,SECONDARY RECOVERY,DECLINE,,23.0,,ONSHORE,-2854.0,134.0,925.0,GAS DRIVE,1141:BASEMENT-UPLIFT ANTICLINE,3674.0,820.0,5.0,,CRETACEOUS,22:DESERT,LAYER-CAKE,BLOCK-BOUNDING FAULT/PALEO-HIGH OR INTRUSIVE MASSLATERAL FACIES CHANGE,,0.35,13.5,SANDSTONE,FINE-GRAINED SAND/MEDIUM-GRAINED SAND,FELDSPATHIC LITHARENITE,,PRIMARY INTERGRANULAR,18.0,70.0,36.0,1.1,0.0,1.0,690.0,,,852.0,,35.0,280.0,,51.8,,CONTINUOUS WATER INJECTION,,DRILLING/STIMULATION/ARTIFICIAL LIFT/OTHER RESERVOIR MANAGEMENT,INFILL WELL,HYDRAULIC FRACTURING (SINGLE STAGE),,ROD PUMP/GAS LIFT,,PROFILE MODIFICATION,1195.0
EL TRAPIAL,LOWER TRONCOSO (HUITRIN),1P ,ARGENTINA,LATIN AMERICA,NEUQUEN,-37.3955,-69.3817,OIL,2006.0,SECONDARY RECOVERY,DECLINE,,23.0,64000.0,ONSHORE,-2854.0,134.0,925.0,GAS DRIVE,1141:BASEMENT-UPLIFT ANTICLINE,2690.0,-164.0,5.0,1722.0,CRETACEOUS,22:DESERT,LAYER-CAKE,BLOCK-BOUNDING FAULTLATERAL FACIES CHANGE,98.0,0.65,,SANDSTONE,FINE-GRAINED SAND/MEDIUM-GRAINED SAND,LITHIC ARKOSE,,SECONDARY INTERGRANULAR,17.0,75.0,36.0,1.1,0.0,1.0,690.0,,,852.0,,35.0,684.0,,52.9,,CONTINUOUS WATER INJECTION,,DRILLING/STIMULATION/ARTIFICIAL LIFT/OTHER RESERVOIR MANAGEMENT,INFILL WELL,HYDRAULIC FRACTURING (SINGLE STAGE),,ROD PUMP/GAS LIFT,,PROFILE MODIFICATION,1195.0
ELK BASIN,TENSLEEP,1P ,UNITED STATES OF AMERICA,NORTH AMERICA,BIG HORN,44.9789,-108.855,OIL,2006.0,ABANDONED,MATURE,19.00,40.0,50000.0,ONSHORE,-4600.0,120.0,2234.0,GAS DRIVE,1111:THRUST ANTICLINE,4000.0,-600.0,35.0,2240.0,CARBONIFEROUS,22:DESERT,LAYER-CAKE,TIGHT CARBONATENONE,250.0,,33.53,SANDSTONE,VERY FINE-GRAINED SAND/FINE-GRAINED SAND,QUARTZ ARENITE,,PRIMARY INTERGRANULAR,17.0,150.0,30.0,,0.0,12.0,310.0,,,,6750.0,8.0,510.0,,,,CONTINUOUS WATER INJECTION/GAS INJECTION,,STIMULATION,,ACIDIZATION,,,,,400.0
ELK HILLS,SHALLOW OIL ZONE (SAN JOAQUIN-ETCHEGOIN),1P ,UNITED STATES OF AMERICA,NORTH AMERICA,SAN JOAQUIN,35.2796,-119.4572,OIL,2008.0,SECONDARY RECOVERY,MATURE,2600.00,12.0,49289.0,ONSHORE,-900.0,130.0,1500.0,AQUIFER DRIVE,1112:FORELAND ANTICLINE,1600.0,700.0,20.0,,NEOGENE,24:COASTAL,LAYER-CAKE,BLOCK-BOUNDING FAULT/SHALELATERAL FACIES CHANGE/SEALING FAULT,3000.0,,,SANDSTONE,FINE-GRAINED SAND/MEDIUM-GRAINED SAND,ARKOSE,,PRIMARY INTERGRANULAR,30.0,1400.0,26.0,20.0,0.0,0.0,140.0,,1.09,1100.0,32500.0,32.0,1600.0,,37.6,,CONTINUOUS WATER INJECTION/GAS INJECTION,THERMAL,DRILLING/STIMULATION/WATER INJECTION OPTIMIZATION/ARTIFICIAL LIFT/SAND CONTROL/OTHER RESERVOIR MANAGEMENT,INFILL WELL/HORIZONTAL WELL,HYDRAULIC FRACTURING (SINGLE STAGE),,ROD PUMP,GRAVEL PACK/SLOTTED LINER,GAS SHUT-OFF/RE-COMPLETION/RE-PERFORATION/SIDETRACKING/WATER PLUGGING,3000.0
ELK HILLS,STEVENS (26 R SAND),1P ,UNITED STATES OF AMERICA,NORTH AMERICA,SAN JOAQUIN,35.2796,-119.4572,OIL,2008.0,SECONDARY RECOVERY,MATURE,903.00,10.0,90254.0,ONSHORE,-900.0,210.0,3155.0,GRAVITY DRAINAGE,112:TRANSPRESSIONAL ANTICLINE,5020.0,4125.0,40.0,1885.0,NEOGENE,25:DEEP MARINE,LAYER-CAKE,SHALELATERAL FACIES CHANGE/LATERAL SHALE-OUT,,0.75,,SANDSTONE,MEDIUM-GRAINED SAND/COARSE-GRAINED SAND,ARKOSE,,PRIMARY INTERGRANULAR,23.6,220.0,36.0,0.42,0.0,0.0,784.0,,1.36,3155.0,32000.0,,463.0,,58.5,,GAS INJECTION,,DRILLING,INFILL WELL/HORIZONTAL WELL,,,,,,
ELK HILLS,STEVENS (31S STRUCTURE),1P ,UNITED STATES OF AMERICA,NORTH AMERICA,SAN JOAQUIN,35.2796,-119.4572,OIL,2008.0,SECONDARY RECOVERY,MATURE,903.00,10.0,90254.0,ONSHORE,-900.0,185.0,3135.0,GAS DRIVE,112:TRANSPRESSIONAL ANTICLINE,4400.0,3500.0,40.0,3150.0,NEOGENE,25:DEEP MARINE,LAYER-CAKE,SHALELATERAL FACIES CHANGE,,0.7,,SANDSTONE,MEDIUM-GRAINED SAND/COARSE-GRAINED SAND,ARKOSE,,PRIMARY INTERGRANULAR,22.0,100.0,36.0,0.5,0.0,0.0,765.0,,1.38,2950.0,32000.0,41.0,1073.0,,51.7,,CONTINUOUS WATER INJECTION/GAS INJECTION,,DRILLING/STIMULATION/WATER INJECTION OPTIMIZATION/ARTIFICIAL LIFT/OTHER RESERVOIR MANAGEMENT,INFILL WELL/HORIZONTAL WELL,ACIDIZATION/HYDRAULIC FRACTURING (SINGLE STAGE),MODIFICATION IN INJECTION PATTERN,ROD PUMP/ESP/GAS LIFT,,GAS SHUT-OFF/PROFILE MODIFICATION/RE-COMPLETION/RE-PERFORATION/WATER PLUGGING,6000.0
ELK HILLS,STEVENS (MBB/W31S SANDS),1P ,UNITED STATES OF AMERICA,NORTH AMERICA,SAN JOAQUIN,35.2796,-119.4572,OIL,2008.0,SECONDARY RECOVERY,MATURE,903.00,20.0,90254.0,ONSHORE,-900.0,185.0,3135.0,GAS DRIVE,112:TRANSPRESSIONAL ANTICLINE,4400.0,3500.0,40.0,3150.0,NEOGENE,25:DEEP MARINE,LAYER-CAKE,SHALELATERAL FACIES CHANGE/LATERAL SHALE-OUT,700.0,0.65,,SANDSTONE,MEDIUM-GRAINED SAND/COARSE-GRAINED SAND,ARKOSE,,PRIMARY INTERGRANULAR,20.0,50.0,36.0,0.55,0.0,0.0,746.0,,1.39,2950.0,32000.0,41.0,610.0,12.0,48.0,,CONTINUOUS WATER INJECTION/GAS INJECTION,,DRILLING/STIMULATION,INFILL WELL/HORIZONTAL WELL,ACIDIZATION/HYDRAULIC FRACTURING (SINGLE STAGE),,,,,6000.0
EMERAUDE,EMERAUDE SILTS-LOANGO-TCHALA,1P ,CONGO,AFRICA,LOWER CONGO,-5.0652,11.8253,OIL,2009.0,ENHANCED OIL RECOVERY,MATURE,113.00,4.0,51000.0,OFFSHORE,200.0,88.0,316.3036514457782,AQUIFER DRIVE,1151:SALT-DIAPIR ANTICLINE,410.0,610.0,2.0,460.0,CRETACEOUS,24:COASTAL,LAYER-CAKE,SHALELATERAL FACIES CHANGE/NON-FRACTURED ZONE,,,,SANDSTONE,SILTMUDSTONE/WACKESTONE,LITHARENITE,,PRIMARY INTERGRANULAR,35.0,5.0,23.0,100.0,0.0,0.0,67.0,,1.01,334.0,70000.0,,5046.0,3.0,7.5,,,THERMAL,DRILLING/STIMULATION/ARTIFICIAL LIFT/OTHER RESERVOIR MANAGEMENT,HORIZONTAL WELL,ACIDIZATION,,ROD PUMP/ESP,,ADDITIONAL PERFORATION/RE-PERFORATION,
EMLICHHEIM,VLIELAND (BENTHEIM),1P ,GERMANY,EUROPE,LOWER SAXONY,52.6634,6.8553,OIL,1999.0,ENHANCED OIL RECOVERY,DECLINE,,9.0,4338.0,ONSHORE,-100.0,99.0,1250.0,GAS DRIVE,113:INVERSION ANTICLINE,2400.0,2300.0,7.0,351.0,CRETACEOUS,24:COASTAL,LAYER-CAKE,BLOCK-BOUNDING FAULT/SHALELATERAL SHALE-OUT,100.0,,21.34,SANDSTONE,VERY FINE-GRAINED SAND/FINE-GRAINED SAND,SUBARKOSE,,PRIMARY INTERGRANULAR,33.0,2000.0,25.0,175.0,7.0,0.01,84.0,,1.05,390.0,,8.0,220.0,,38.6,,CONTINUOUS WATER INJECTION,THERMAL,DRILLING/ARTIFICIAL LIFT/SAND CONTROL/OTHER RESERVOIR MANAGEMENT,INFILL WELL/HORIZONTAL WELL/EXTENDED REACH WELL,,,ROD PUMP,SAND SCREEN,RE-COMPLETION,2625.0
ENDICOTT,KEKIKTUK,1P ,UNITED STATES OF AMERICA,NORTH AMERICA,NORTH SLOPE,70.3458,-148.0193,OIL,2008.0,ENHANCED OIL RECOVERY,MATURE,122.00,40.0,113990.0,OFFSHORE,8.0,218.0,4870.0,GAS DRIVE,1211:TILTED FAULT-BLOCK,9484.0,9492.0,5.0,702.0,CARBONIFEROUS,21:FLUVIAL,LAYER-CAKE,BLOCK-BOUNDING FAULT/SHALE/TAR MATLATERAL FACIES CHANGE,800.0,0.5,102.72,SANDSTONE,MEDIUM-GRAINED SAND,SUBLITHARENITE,,PRIMARY INTERGRANULAR,22.0,1000.0,23.0,1.0,0.0,0.0,763.0,,1.35,4840.0,30000.0,13.8,1267.0,10.0,54.0,89.0,CONTINUOUS WATER INJECTION/GAS RECYCLING,CHEMICAL/MISCIBLE,DRILLING/STIMULATION/ARTIFICIAL LIFT/OTHER RESERVOIR MANAGEMENT,MULTI-LATERAL WELL,ACIDIZATION,,GAS LIFT,,RE-COMPLETION/SIDETRACKING/WATER PLUGGING,10000.0
